{
  "schema": "skyrim-forge-automation/1",
  "job_id": "verify-example-release",
  "operation": "verify_release",
  "description": "Run release hygiene, framework lint, and optionally installed xEdit evidence.",
  "inputs": {
    "root": "<Workspace>/Example Mod/Release",
    "plugin": "Example Mod.esp"
  },
  "options": {
    "mo2_profile": "Current"
  },
  "outputs": {}
}
